{
  "id": "gemma-4-e2b-q4kxl--unknown",
  "kind": "quant",
  "model_id": "gemma-4-e2b-it",
  "repository": "gemma-4-e2b-q4kxl",
  "revision": null,
  "schema_version": "local-ai-registry/v1",
  "served_name": "gemma-4-e2b-q4kxl",
  "url": null,
  "weights": {
    "artifact": "gemma-4-e2b-q4kxl",
    "format": null,
    "precision": "unknown",
    "publication_id": "pg-20260827T060320709Z",
    "size_gb": null,
    "source": "exo-postgres"
  }
}
