{
  "id": "prism-ml-bonsai-27b-gguf--q1-0",
  "kind": "quant",
  "model_id": "bonsai-27b",
  "repository": "prism-ml/Bonsai-27B-gguf",
  "revision": null,
  "schema_version": "local-ai-registry/v1",
  "served_name": "Bonsai-27B-gguf",
  "url": "https://huggingface.co/prism-ml/Bonsai-27B-gguf",
  "weights": {
    "artifact": "prism-ml/Bonsai-27B-gguf",
    "format": null,
    "precision": "Q1_0",
    "publication_id": "pg-20260827T060320709Z",
    "size_gb": null,
    "source": "exo-postgres"
  }
}
