{
  "id": "google-gemma-4-12b-it-qat-q4-0-gguf--q4-0",
  "kind": "quant",
  "model_id": "gemma-4-12b-it-qat-q4-0-unquantized",
  "repository": "google/gemma-4-12B-it-qat-q4_0-gguf",
  "revision": null,
  "schema_version": "local-ai-registry/v1",
  "served_name": "gemma-4-12B-it-qat-q4_0-gguf",
  "url": "https://huggingface.co/google/gemma-4-12B-it-qat-q4_0-gguf",
  "weights": {
    "format": "safetensors",
    "precision": "Q4_0",
    "size_gb": null
  }
}
