{
  "id": "hcompany-holo-3-1-35b-a3b-gguf--unknown",
  "kind": "quant",
  "model_id": "holo-3-1-35b-a3b",
  "repository": "Hcompany/Holo-3.1-35B-A3B-GGUF",
  "revision": null,
  "schema_version": "local-ai-registry/v1",
  "served_name": "Holo-3.1-35B-A3B-GGUF",
  "url": "https://huggingface.co/Hcompany/Holo-3.1-35B-A3B-GGUF",
  "weights": {
    "artifact": "Hcompany/Holo-3.1-35B-A3B-GGUF",
    "format": null,
    "precision": "unknown",
    "publication_id": "pg-20260827T060320709Z",
    "size_gb": null,
    "source": "exo-postgres"
  }
}
