{
  "id": "nvidia-qwen3-6-27b-nvfp4--nvfp4-modelopt-mixed-w4a16-fp8",
  "kind": "quant",
  "model_id": "qwen3-6-27b",
  "repository": "nvidia/Qwen3.6-27B-NVFP4",
  "revision": null,
  "schema_version": "local-ai-registry/v1",
  "served_name": "Qwen3.6-27B-NVFP4",
  "url": "https://huggingface.co/nvidia/Qwen3.6-27B-NVFP4",
  "weights": {
    "format": "safetensors",
    "precision": "NVFP4 modelopt-mixed W4A16+FP8",
    "size_gb": null
  }
}
