{
  "id": "lasimeri-minimax-m2-7-int4-autoround--autoround-w4a16",
  "kind": "quant",
  "model_id": "minimax-m2-7",
  "repository": "Lasimeri/MiniMax-M2.7-int4-AutoRound",
  "revision": null,
  "schema_version": "local-ai-registry/v1",
  "served_name": "MiniMax-M2.7-int4-AutoRound",
  "url": "https://huggingface.co/Lasimeri/MiniMax-M2.7-int4-AutoRound",
  "weights": {
    "format": "safetensors",
    "precision": "AutoRound W4A16",
    "size_gb": null
  }
}
